Text,Location/Date,Stars,Word Count,Month,Product,Brand
"Tastes and smells like chemicals, not like other toothpaste. Threw it all away.  Not made in USA and have some concerns about the quality control.","Reviewed in the United States on December 16, 2024",1.0,25,December,1,1
"The flavor is a hit with my little ones—they actually look forward to brushing their teeth now! I appreciate that it provides effective cavity protection while being gentle on their developing teeth. The packaging is also eye-catching and appealing to kids, which helps encourage them to brush regularly.","Reviewed in the United States on December 16, 2024",5.0,48,December,1,1
So cool to order toothpaste online for so cheap and get it so quickly! Thanks,"Reviewed in the United States on December 15, 2024",5.0,15,December,1,1
My child has had no complaints with wearing these the past couple days. They run true to size!,"Reviewed in the United States on December 14, 2024",5.0,18,December,1,1
"This children’s toothpaste is specially designed for young kids. It has a mild, fruity flavor that makes brushing enjoyable. The formula is gentle on sensitive gums and teeth, fluoride-free, and safe if accidentally swallowed. It’s a great choice to build healthy brushing habits for children.","Reviewed in the United States on December 13, 2024",5.0,45,December,1,1
Perfect,"Reviewed in the United States on December 11, 2024",5.0,1,December,1,1
"Checks every box!Fluoride, tasty, dentist approved, kid loved","Reviewed in the United States on December 11, 2024",5.0,8,December,1,1
Kids love this tooth paste and it is dentist approved.  Cheaper than store.,"Reviewed in the United States on December 6, 2024",5.0,13,December,1,1
Packaged as three and arrived with one of the boxes open and missing contents.,"Reviewed in the United States on December 4, 2024",1.0,14,December,1,1
"My kids enjoy this toothpaste. They said it doesn’t taste terrible, cleans their teeth well and leaves their breath smelling fresh!","Reviewed in the United States on December 1, 2024",5.0,21,December,1,1
This is the only flavor toothpaste that my kids like!,"Reviewed in the United States on November 29, 2024",5.0,10,November,1,1
What the dentist gave the kids. They love it.  Win win.,"Reviewed in the United States on November 27, 2024",5.0,11,November,1,1
My grandkids did not like the taste of this toothpaste!,"Reviewed in the United States on November 24, 2024",3.0,10,November,1,1
Not kids toothpaste- same ingredients as adult versions,"Reviewed in the United States on November 22, 2024",1.0,8,November,1,1
My kids favorite toothpaste. They say it tastes good. And good value for the price.,"Reviewed in the United States on November 18, 2024",5.0,15,November,1,1
"It was 3 packs for 4.60, very easy on the pockets and child loves it","Reviewed in the United States on November 16, 2024",5.0,15,November,1,1
Good for stocking stuffers for teens!,"Reviewed in the United States on November 15, 2024",5.0,6,November,1,1
"Very fast delivery and good, great deals","Reviewed in the United States on November 13, 2024",5.0,7,November,1,1
Safe and kid friendly,"Reviewed in the United States on November 12, 2024",5.0,4,November,1,1
Will buy again,"Reviewed in the United States on November 11, 2024",5.0,3,November,1,1
My kids love this product and request only this toothpaste!,"Reviewed in the United States on November 6, 2024",5.0,10,November,1,1
My kids love this flavored toothpaste. It's the sparkly blue that tastes like bubblegum. Got it 36% off for 3 tubes at $4.97. Full size tubes. Cheaper in the end than the small dollar store tubes lol,"Reviewed in the United States on November 4, 2024",5.0,37,November,1,1
My son likes this kind of toothpaste. We were almost out and my local store didn’t have any so I looked on Amazon. They had an even better deal than my local store and it would get here before we ran out. Great value for the quantity.,"Reviewed in the United States on November 2, 2024",5.0,47,November,1,1
Hard to beat for the price for kids toothpaste.,"Reviewed in the United States on October 29, 2024",5.0,9,October,1,1
My kids like it. It gives breath freshness.,"Reviewed in the United States on October 28, 2024",5.0,8,October,1,1
"i am 72 years, and I’ve been using Sparkle for more that 30.  I have a very sensible mouth. Everything h the dentist prescribed makes my mouth raw.  I.always fall back on Sparkle child’s.  Thank you Crest","Reviewed in the United States on October 23, 2024",5.0,37,October,1,1
Great deal,"Reviewed in the United States on October 20, 2024",5.0,2,October,1,1
"I bought this Kid's Crest toothpaste to donate to children who are less fortunate and need basic hygiene/ personal care items. So, I can't speak for this particular product. I have used other Crest oral care products and they are consistently good. Yes, I would recommend this product.","Reviewed in the United States on October 18, 2024",4.0,48,October,1,1
Not harsh on the kids it gets the job done great taste. Color is blue,"Reviewed in the United States on October 18, 2024",5.0,15,October,1,1
Did an amazing job,"Reviewed in the United States on October 11, 2024",5.0,4,October,1,1
super valuable deal for the price highly recommend,"Reviewed in the United States on October 10, 2024",4.0,8,October,1,1
"Doesn't spread easily, tends to stay in clumps.","Reviewed in the United States on October 8, 2024",4.0,8,October,1,1
I can't do mint toothpastes and this cinnamon variety is a (virtual) life-saver. There are very few flavors left that don't have mint in there somewhere. I appreciate that this is still out there even if it is for kids.,"Reviewed in the United States on October 7, 2024",5.0,40,October,1,1
Has been using it for almost 3 years. Fantastic toothpaste.,"Reviewed in the United States on September 29, 2024",5.0,10,September,1,1
My 6years daughter adore it!!!,"Reviewed in the United States on September 25, 2024",5.0,5,September,1,1
Keeps my son teeth healthy and clean,"Reviewed in the United States on September 22, 2024",5.0,7,September,1,1
"Getting my kids to brush their teeth is a challenge. Ever since I started using this Crest toothpaste, they've been more cooperative. They love the flavor, and the sparkling vibrant color is fun for them.","Reviewed in the United States on September 21, 2024",5.0,35,September,1,1
Son loves this flavor and gets excited about brushing his teeth! Thanks,"Reviewed in the United States on September 20, 2024",5.0,12,September,1,1
"My daughter loves this toothpaste. She really likes the taste and color of it. It’s good quality toothpaste, a big tube, and a bang for your buck. Cleans the teeth as needed and keeps breath fresh. Love how bubbly it is also! Easy for the kids to use alone.","Reviewed in the United States on September 20, 2024",5.0,49,September,1,1
My kids prefer the strawberry flavor over the sparkle one... and it's hard to get the strawberry flavor in stores.,"Reviewed in the United States on September 15, 2024",5.0,20,September,1,1
My mistake! I ordered for myself & teen kids.Non of us like it because it's sweet.  Toothpaste should never be sweet!!,"Reviewed in the United States on September 14, 2024",1.0,21,September,1,1
"Most of the kiddie toothpaste my son has tried does NOT seem to actually clean the teeth/ freshen the breath all that well.This Kid’s Crest paste is definitely an exception!While it is still a “bubbly” and kiddie flavor, It actually freshens the breath and keeps my kids teeth clean.The two pack is an awesome value as well, He will have paste for most likely a year!Cant beat the value and the quality.Truthfully, I have even used this paste myself a few times and it was just as effective as if I used my Crest Adult paste!Very happy with this purchase!!","Reviewed in the United States on September 13, 2024",5.0,100,September,1,1
"The toothpaste has a beautiful color that my child really liked, but unfortunately, they found the taste a bit too strong. This is their first time trying a toothpaste with a minty flavor, and they weren’t a fan—it was “a little spicy” for them. It might be good for kids who are already used to mint, but it wasn’t a hit for us.","Reviewed in the United States on September 11, 2024",3.0,63,September,1,1
My children love this toothpaste.,"Reviewed in the United States on September 7, 2024",5.0,5,September,1,1
Es la que siempre uso con mis niños y hasta hora les va excelente,"Reviewed in the United States on September 4, 2024",5.0,14,September,1,1
My kids love this toothpaste! I love the ease of click and ship!,"Reviewed in the United States on September 4, 2024",5.0,13,September,1,1
Now here's value for your money.,"Reviewed in the United States on September 3, 2024",5.0,6,September,1,1
Texture cleanliness ease of use performance my daughter loves it,"Reviewed in the United States on September 2, 2024",5.0,10,September,1,1
Excelente para tus niños,"Reviewed in the United States on August 25, 2024",4.0,4,August,1,1
This toothpaste tastes great and is good value for money.,"Reviewed in the United States on August 23, 2024",4.0,10,August,1,1
Good deal. Kids like it.,"Reviewed in the United States on August 19, 2024",5.0,5,August,1,1
This toothpaste is wonderful stuff.  Has all the necessary ingredients as well as an appealing flavor.,"Reviewed in the United States on August 16, 2024",5.0,16,August,1,1
Great value,"Reviewed in the United States on August 14, 2024",5.0,2,August,1,1
My son loves it,"Reviewed in the United States on August 12, 2024",4.0,4,August,1,1
My little one loved it. Good size and quality is good. Kids friendly. Fit in budget. Highly recommend it.,"Reviewed in the United States on August 9, 2024",5.0,19,August,1,1
great product from amazon,"Reviewed in the United States on August 5, 2024",5.0,4,August,1,1
Highly recommend this toothpaste for kids. Good on  their  teeth. And definitely cannot beat the price for three.,"Reviewed in the United States on July 31, 2024",5.0,18,July,1,1
Very nice toothpaste for kids. Nice packaging. Cleans teeth nicely!!,"Reviewed in the United States on July 29, 2024",5.0,10,July,1,1
Nothing special,"Reviewed in the United States on July 27, 2024",3.0,2,July,1,1
A mi hija le gusta,"Reviewed in the United States on July 24, 2024",5.0,5,July,1,1
Our 3 year old love the taste of this toothpaste!,"Reviewed in the United States on July 24, 2024",5.0,10,July,1,1
My kids love this flavor- great deal.,"Reviewed in the United States on July 10, 2024",4.0,7,July,1,1
"We are very satisfied with the product. However, we later found that the price was not competitive as compared other retailers. I would cross check the prices next time I purchase items.","Reviewed in the United States on June 30, 2024",5.0,32,June,1,1
Duradera,"Reviewed in the United States on June 25, 2024",5.0,1,June,1,1
"My kids' favorite toothpaste. They love the taste, I love the price. Doctor approved.","Reviewed in the United States on June 15, 2024",5.0,14,June,1,1
Sure the Crest Toothpaste matches the expectation for all the kids that’s the reason its their favorite,"Reviewed in the United States on June 15, 2024",4.0,17,June,1,1
My favorite tooth paste to use for my daughter.. it cleans her teeth so well!,"Reviewed in the United States on June 10, 2024",5.0,15,June,1,1
"My 11 year old son is picky when it comes to toothpaste. He enjoys this product's flavor and freshness. It comes in the perfect size for everyday or travel. His teeth appear whiter and clean. Overall, great performance for a non-sensitive kids' toothpaste.","Reviewed in the United States on June 9, 2024",5.0,43,June,1,1
My son loved this flavor. I'll definitely be repurchasing in the future. Big tube's as well.,"Reviewed in the United States on June 5, 2024",5.0,16,June,1,1
Always buy for my 5 year old son. Worth money for the pack. Quality great. Texture is good. Size is big and worth money. Easy to use,"Reviewed in the United States on June 2, 2024",5.0,27,June,1,1
"My kids like it’s flavor, kind of bubble gum and fresh.","Reviewed in the United States on May 30, 2024",5.0,11,May,1,1
"My son is almost 5 years old and he likes the toothpaste. He likes the taste and color!I have been using another big brand for the last couple of years( that his dentist reccommend) but his front two upper teeth were so dark… so I decided to switch to crest!  My son has been using it for less that a week and I see amazing result! The darkness/ coloring is gone! Teeth look clean, white, smells great! definately reccommend!","Reviewed in the United States on May 29, 2024",5.0,79,May,1,1
Hate the flavor but my kids like it,"Reviewed in the United States on May 28, 2024",1.0,8,May,1,1
"Bought on sale, cheaper than Walmart! My kids love it!","Reviewed in the United States on May 28, 2024",5.0,10,May,1,1
"My children adore anything that sparkles, and that includes this toothpaste. We’re big fans of the value pack.","Reviewed in the United States on May 26, 2024",5.0,18,May,1,1
Great value & product.,"Reviewed in the United States on May 26, 2024",5.0,4,May,1,1
Usually buy this,"Reviewed in the United States on May 25, 2024",5.0,3,May,1,1
using this brand for years,"Reviewed in the United States on May 19, 2024",5.0,5,May,1,1
My family loves this,"Reviewed in the United States on May 16, 2024",5.0,4,May,1,1
"We've been using this toothpaste brand for several years now, and it's the only one my picky children actually like! The flavor is great, which makes it easier to encourage them to brush their teeth regularly. Its cleaning power is impressive, and it effectively helps prevent cavities, making it a reliable choice for our family.  We've tried several brands over the years, but we always come back to this one. Highly recommended for families with kids!","Reviewed in the United States on May 16, 2024",5.0,76,May,1,1
"The mint flavor is too stimulating for children aged 3-4 years old and is not suitable for children😅😅😅 The blue paste is very popular with children, but the taste is too pungent. The children said it is ""spicy"".","Reviewed in the United States on May 14, 2024",3.0,38,May,1,1
"We have tried a few different flavors, but my kids just like this one before it has no mint - mint to kids is too strong smelling and feeling.","Reviewed in the United States on May 13, 2024",5.0,29,May,1,1
I buy this toothpaste for my son because he likes it. 3 for $4 is unbeatable!,"Reviewed in the United States on May 12, 2024",5.0,16,May,1,1
Excélente para los nińos,"Reviewed in the United States on May 12, 2024",5.0,4,May,1,1
"Great toothpaste.  Not harsh on the gums, and does not burn.","Reviewed in the United States on May 8, 2024",5.0,11,May,1,1
Great toothpaste!,"Reviewed in the United States on May 7, 2024",5.0,2,May,1,1
The only brand I've been using for my toddler.,"Reviewed in the United States on May 7, 2024",5.0,9,May,1,1
My son loves this toothpaste. Some toothpastes he complains that it’s too “spicy” but he does great with this kind and keeps his teeth looking great!,"Reviewed in the United States on May 6, 2024",5.0,26,May,1,1
"My younger brothers and sisters LOVE this! As it has that strawberry taste and color, a little sweet, shines your teeth really good! Easy to use for kids! Easy to open and squeeze !!🔥","Reviewed in the United States on April 29, 2024",5.0,34,April,1,1
"Only toothpaste my kids will use. They love the smell, the color and the taste. It makes their teeth feel and look clean. I have to help them with the lid and dispensing the gel but other than that they like it.","Reviewed in the United States on April 28, 2024",5.0,42,April,1,1
This is the one toothpaste my daughter will use. She loves the taste!,"Reviewed in the United States on April 24, 2024",5.0,13,April,1,1
my kiddo doesnt like minty toothpaste and this is perfect for him.,"Reviewed in the United States on April 19, 2024",5.0,12,April,1,1
"The media could not be loaded.I purchased the Crest Kid's Cavity Protection Toothpaste in Sparkle Fun for my toddler. The size is perfect for little hands, and the toothpaste is easy to use. It has a pleasant smell and taste that my child enjoys. The toothpaste leaves his teeth feeling clean without any issues of dryness or sensitivity. The fun color adds to the appeal for kids. Overall, it's a great toothpaste option for children, combining fun and effective cavity protection.","Reviewed in the United States on April 19, 2024",5.0,81,April,1,1
Ease of use and the size perfect,"Reviewed in the United States on April 17, 2024",3.0,7,April,1,1
"My kids love the flavor , its good quality from a trusted brand ,","Reviewed in the United States on April 12, 2024",5.0,14,April,1,1
My kids like the taste of this toothpaste,"Reviewed in the United States on April 10, 2024",5.0,8,April,1,1
"I purchased some other toothpastes and my lids didn’t liked the flavors, but these ones are great. I highly recommend it.","Reviewed in the United States on April 9, 2024",5.0,21,April,1,1
Cleaning my teeth.,"Reviewed in the United States on April 7, 2024",5.0,3,April,1,1
"Both my kids are finally at the age to brush their teeth, so I wanted a value pack so I never run out! This toothpaste is great! I always love anything crest, and my kids will even say mmm when they go to brush their teeth. This makes toddlers brushing their teeth so much easier, since they enjoy the taste!","Reviewed in the United States on April 3, 2024",5.0,60,April,1,1
"Always loved this magical sparkle toothpaste. Loved getting to use this stuff at a friends house growing up. THEN my kids got a tiny tube of it from the dentist. So, I treated them to it because how cool that TOOTHPASTE is a prize?!?! Good value, too. Win, win, win. -mother of 5 honest late night reviewer on husband’s account, at your service.","Reviewed in the United States on April 2, 2024",5.0,63,April,1,1
"Noticeable difference after 4 strips, and no sensitive issues even though I have sensitive teeth. Would repurchase","Reviewed in the United States on December 17, 2024",5.0,17,December,2,1
"These do work, but they don’t work miracles. I definitely noticed a difference but my teeth aren’t super white. There was never tooth sensitivity but the strips did irritate my gums a little bit. I just took a day off when they bothered me and it was fine. I recommend but on sale. The results I saw for full price isn’t worth it in my opinion. I got these for about 40% off for Black Friday.","Reviewed in the United States on December 17, 2024",4.0,76,December,2,1
These do really work! Every time I went to the store I would always forget to grab a box especially since I take a lot of headshots/photos for my business. These works!,"Reviewed in the United States on December 17, 2024",5.0,32,December,2,1
"I'm a senior citizen. I have some caps, so the teeth next to them look dark. These strips took care of that.","Reviewed in the United States on December 16, 2024",5.0,22,December,2,1
they work really well.,"Reviewed in the United States on December 16, 2024",5.0,4,December,2,1
Good control light weight less pressure to hit a solid shots,"Reviewed in the United States on December 15, 2024",5.0,11,December,2,1
Cost always puts out a good product.  I will order again if needed.,"Reviewed in the United States on December 15, 2024",5.0,13,December,2,1
This particular kind of strip burned my gums within 20 minutes of using them once. It’s surprising because I’ve used all different kinds before.,"Reviewed in the United States on December 14, 2024",1.0,24,December,2,1
I Use it for years,"Reviewed in the United States on December 14, 2024",5.0,5,December,2,1
I used this product a week straight and saw a difference in my teeth! Use regularly. The straps are easy and stay on!,"Reviewed in the United States on December 14, 2024",5.0,23,December,2,1
My dentist told me Crest strips are safe. I’ve used them for years! Amazon has the best prices for them.,"Reviewed in the United States on December 13, 2024",5.0,20,December,2,1
It’s easy and really works.  Very satisfied,"Reviewed in the United States on December 13, 2024",5.0,7,December,2,1
"The individual strips are labeled in French and English, package is English and designates they are Profesional strips.  More importantly, the individual packs are not labeled as to which strips they actually are (ie: Professional, Vivid…).  Will likely return.","Reviewed in the United States on December 13, 2024",1.0,39,December,2,1
"Definitely works but made my teeth super sensitive after repeated usage, I have found similar results from less invasive products","Reviewed in the United States on December 13, 2024",4.0,20,December,2,1
"Love it, hoping for more","Reviewed in the United States on December 13, 2024",4.0,5,December,2,1
"Almost 3 months on and off of using the product. If I was only consistent my teeth would have been brighter than what it is right now. Sometimes I would use it 3 days straight then 1 or 2 days not. Also I would only brush my teeth once a day because my gums would get bruises if I brush more. I never had this issue when I was younger, this just started not long ago maybe due to aging. (Please excuse my not so pleasant mouth. I have so much gums, crooked teeth. I just wanted to share this journey and give hope to others).","Reviewed in the United States on December 13, 2024",5.0,106,December,2,1
Really didn't think this would work as I hv drank coke and coffee all my life!!!!  After using just 4 strips I was getting so many compliments about my teeth!!!!! I'm so glad I bought them!!!!,"Reviewed in the United States on December 13, 2024",5.0,36,December,2,1
Love this product and used it for years. Highly recommend!! I get compliments on my white teeth on a regular basis.,"Reviewed in the United States on December 13, 2024",5.0,21,December,2,1
"Made my teeth really sensitive. It would last for a whole day or more and be very bothersome - especially in the winter time with the cold air. I tried taking a break for a day or two, still did it, then a week or so, made them sensitive again. I wouldn't recommend if you are already experiencing sensitive teeth in any capacity or if you have had dental work. I would return for a refund but I honestly don't want to go through the hastle.","Reviewed in the United States on December 13, 2024",2.0,86,December,2,1
Efficiently whitens our families teeth,"Reviewed in the United States on December 13, 2024",5.0,5,December,2,1
"I received the Crest 3D Whitestrips, Professional Effects [LEVELS 20 WHITER] Teeth Whitening Strip Kit, 44 Strips (22 Count Pack) a few weeks ago. I only use the Whitestrips once a week, but my teeth are noticeable whiter. The Amazon description and picture were accurate and exactly what I was sent. I'm very satisfied with these Whitestrips, and they're an economical way to whiten teeth as compared to having it professionally done at the dentist's office.","Reviewed in the United States on December 12, 2024",5.0,76,December,2,1
"I bought them during the Black Friday sale, really good price and quality, I love how they fit my teeth and it has been working well.","Reviewed in the United States on December 12, 2024",5.0,26,December,2,1
"These are great, especially on prime day!!","Reviewed in the United States on December 12, 2024",5.0,7,December,2,1
This did not work for me. I will not buy again.,"Reviewed in the United States on December 12, 2024",2.0,11,December,2,1
"They can only get your teeth so white. If you are looking for major changes, you should probably go to a professional.","Reviewed in the United States on December 12, 2024",4.0,22,December,2,1
"I have purchased these multiple times over the years and am always happy with them. I see results within a couple of uses. My only complaint is sometimes you get a bad whitestrip that doesn’t stick well, but that’s an exception and not the norm.","Reviewed in the United States on December 12, 2024",5.0,45,December,2,1
I have sensitive teeth and the strip was like glued on. It was hard to pull off it hurt. It did not whitened nothing and left the glue type stuff on my teeth,"Reviewed in the United States on December 12, 2024",1.0,33,December,2,1
Works great as always. Would repurchase,"Reviewed in the United States on December 11, 2024",5.0,6,December,2,1
Perfect for the teeth,"Reviewed in the United States on December 11, 2024",5.0,4,December,2,1
Did a great on my teeth,"Reviewed in the United States on December 11, 2024",5.0,6,December,2,1
Got me looking good for wedding,"Reviewed in the United States on December 11, 2024",4.0,6,December,2,1
Crest has never let me down. Been using this product for at least 10 years  52 yo with a white smile,"Reviewed in the United States on December 11, 2024",5.0,21,December,2,1
"First yes this product absolutely works to whiten your teeth.  No matter where you look this one works on regular teeth staining.  I have used ~ half of the package now (once per week) and see a noticeable difference in my teeth color.The only thing that users should be warned about is to be a bit careful if you have sensitive gums to make sure you don't get too much overlap from the base of the teeth onto the gums.  I have some sensitivity and I can notice when I get the strip too far onto the gums.  Otherwise these are great, easy to use, clean up nicely and would purchase them again.","Reviewed in the United States on December 11, 2024",4.0,113,December,2,1
I was taping the lid and wrapping this for a friend who’s a bride to be and when I opened the box I gasped. There is only 22 strips in the box instead of 44. I am very unpleased with this and shocked that it would be delivered with half of the strips inside. Plus these are expensive.,"Reviewed in the United States on December 11, 2024",1.0,58,December,2,1
