Text,Location/Date,Stars,Word Count,Month,Product,Brand
"Anybody who would eat this garbage has to be like, starving. I can’t believe Kraft would go this low and distribute their deluxe brand M&C knowing how unhealthy it is. If you want the real thing just buy Kraft regular M&C,  It’s still a little salty but far better than the deluxe crap.","Reviewed in the United States on November 17, 2024",1.0,53,November,8,3
Kraft Deluxe Original Mac and Cheese never disappoints.,"Reviewed in the United States on November 17, 2024",5.0,8,November,8,3
Just the right sizes for a big family.,"Reviewed in the United States on November 4, 2024",5.0,8,November,8,3
"Best macaroni ever!!! Easy to make , great value for the 3 pack!","Reviewed in the United States on November 1, 2024",5.0,13,November,8,3
"I'm a person who works 52-54 hours a week. I don't have time to breathe let alone visit a grocery store, so finding things I can somewhat cook in a flash that don't require refrigerated items is a blessing. You don't need butter or milk for this mac and cheese, thank god. I can order condiments off Amazon if I wanna spice up the flavor, but I'm happy to have this plain, or with spicy sauce, or ketchup. Great if you have very little time and/or are heavily introverted and hate visiting grocery stores. 10/10.","Reviewed in the United States on October 26, 2024",5.0,95,October,8,3
Always in the pantry,"Reviewed in the United States on October 25, 2024",5.0,4,October,8,3
Too much sodium & not much cheese flavor.  Elbows are so tiny they only take 2-3 minutes to cook otherwise they get mushy.  Better and cheaper alternative would be to buy a plain box of elbows and a block of Velveeta cheese.,"Reviewed in the United States on October 24, 2024",2.0,42,October,8,3
These are so easy to make and cook in Three minutes. Taste great and the value size is great,"Reviewed in the United States on October 23, 2024",5.0,19,October,8,3
Of course the kids (and adults) love the kraft macaroni and cheese.We bought from Amazon because they were cheaper for the 3 packs then the grocery store!The kids would eat this every day if they could lol.,"Reviewed in the United States on October 16, 2024",5.0,37,October,8,3
"I love this Mac & Cheese ,for Lunch or for Supper as a side dish ...My kids & grandkids love this Deluxe Mac & Cheese too !!Add No Beans chilli for Chilli Mac. Or Tuna or skinless Chicken , cut in bite size pieces .Cheap & fast easy meals !","Reviewed in the United States on October 12, 2024",5.0,50,October,8,3
Best Mac and cheese,"Reviewed in the United States on October 10, 2024",5.0,4,October,8,3
"I bought this hoping for, as far as Mac n Cheese goes, a gourmet treat. I was disappointed that, in my opinion, it tastes worse than their regular.","Reviewed in the United States on October 3, 2024",1.0,28,October,8,3
"I have had a lot of cheap mac and cheese in my life, which means I don't consume a lot of kraft mac and cheese.  That being said, I had to have the lowest price point non-dry mac and cheese on Amazon.  Which was a 3-pack of kraft deluxe.  The pasta is so much more dense and the cheese sauce is more plentiful, more cheesy, and less salty than Velveeta or dollar store varieties.  Turned the usual dry mac and cheese casserole (tuna, peas, 2tbsp fine-minced onion), sometimes a one-sitting meal, into a much denser meal I eat a cupful at a time and find more enjoyable.The higher price is justified.  Feel free to lower it anytime, though, Kraft.","Reviewed in the United States on September 28, 2024",5.0,119,September,8,3
Kraft Mac n Cheese is yummy..,"Reviewed in the United States on September 28, 2024",5.0,6,September,8,3
My family loved this mac n cheese! The cheese sauce is yummy! And you don't need milk or butter! Perfect quick dinner side on a budget,"Reviewed in the United States on September 26, 2024",5.0,26,September,8,3
"Returned; family sized packaged, not powdered cheese. Creamy packets.  Wanted individual cups, with powdered cheese.","Reviewed in the United States on September 10, 2024",1.0,15,September,8,3
,"Reviewed in the United States on September 4, 2024",4.0,1,September,8,3
My fave “boxed” Mac n cheesePerfect when no milk or butter in house.Add a pinch nutmeg and top with toasted breadcrumbs.  Taste homemade to me!,"Reviewed in the United States on August 28, 2024",5.0,25,August,8,3
When receiving this package. Two of the Kraft boxes were open and had to be thrown out.,"Reviewed in the United States on August 13, 2024",1.0,17,August,8,3
good,"Reviewed in the United States on August 12, 2024",5.0,1,August,8,3
I love this product. It is the original product my family remembers. It is difficult to find in grocery stores our area.,"Reviewed in the United States on August 5, 2024",5.0,22,August,8,3
Great camping food. Shelf stable. No butter or milk needed. Easy to make. Kid favorite,"Reviewed in the United States on August 1, 2024",5.0,15,August,8,3
last box made me very sick and they refused to cancel this one.  throwing them away when they arrive.,"Reviewed in the United States on July 30, 2024",1.0,19,July,8,3
"I grew up on basic Kraft mac, and Velveeta was the fancy stuff. I cannot believe I didn't try this until recently. It is HANDS DOWN the best of its type. Although technically, the sharp cheddar is my favorite, but even original cheddar is delicious. It is much better than others with the pouch cheese. If you haven't tried it, you need to!","Reviewed in the United States on July 30, 2024",5.0,63,July,8,3
This is a good price for mac & cheese. The kids love it.,"Reviewed in the United States on July 26, 2024",5.0,13,July,8,3
This stuff is really horrible and artificial tasting to me. Way worse than any mac should be.,"Reviewed in the United States on July 18, 2024",1.0,17,July,8,3
Thank you,"Reviewed in the United States on July 12, 2024",4.0,2,July,8,3
"Simply,.......... DELICIOUS 😋","Reviewed in the United States on June 26, 2024",5.0,3,June,8,3
came after the expiration date,"Reviewed in the United States on June 16, 2024",1.0,5,June,8,3
Vile disgusting product.,"Reviewed in the United States on June 11, 2024",1.0,3,June,8,3
"This has to be one of the best Mac and cheese I’ve had! Super creamy and easy to make. The cheese and of good quality, making it very delicious! If you haven’t already, definitely try them!","Reviewed in the United States on June 6, 2024",5.0,36,June,8,3
I have loved Kraft Mac and Cheese since I was a kid. But the noodle recipe/flavor ruined this for me. I ended up using the cheese packs with other noodles I already had. I threw the noodles that came with this out.,"Reviewed in the United States on May 28, 2024",3.0,42,May,8,3
I got them for my grandson for when he comes home from school he loves mac and cheese I need to order some more to good price for three boxes,"Reviewed in the United States on May 26, 2024",5.0,30,May,8,3
"The lead is that with this baby - the ""DELUXE"" edition - Kraft has officially brought back the gooey cheese that used to come in a can.  Now it comes in a foil packet.  It's squishy, already pre-mixed and is NOT the ""standard"" Kraft cheese powder that comes in other boxes.This means more convenience, less waste and none of that ""congealed"" powder that doesn't quite dissolve with the macaroni!  The same beautiful taste I remember!  This is a BIGGER deal than most realize.  Thank you!","Reviewed in the United States on May 25, 2024",5.0,85,May,8,3
It's excellent it's fresh no complaints,"Reviewed in the United States on May 4, 2024",5.0,6,May,8,3
Good boxed Mac and cheese at a great price. Will buy again.,"Reviewed in the United States on May 1, 2024",5.0,12,May,8,3
This product is nothing like what you buy in stores. The noodles are oddly smaller and they become extremely slimy when boiled. Complete waste of money.,"Reviewed in the United States on April 19, 2024",1.0,26,April,8,3
Nice quantity for one person meal,"Reviewed in the United States on April 17, 2024",4.0,6,April,8,3
Tastes decent enough. Would recommend tossing in a few chunks of some nice sharp/aged cheddar as well as a cup and a half of peas or some other veggies. The cheddar to add a bit more flavor and veggies to cut the richness of the packet cheese. Not as great as the Cracker Barrel mac and cheese or some of the other brands but gets the jobs done.,"Reviewed in the United States on April 14, 2024",4.0,68,April,8,3
"I buy this product frequently. I would suggest buying at a physical store, however, because mine shipped in a poly bag via US Mail.I opened the bag upon arrival and macaroni pieces and powdered macaroni came out of the poly mailing bag. The boxes of macaroni were open at the corners due to being crushed.I will continue to purchase the product as it makes a good side dish at dinner, but won't order the product online anymore.","Reviewed in the United States on April 8, 2024",3.0,77,April,8,3
"Short, half size noodles combined with a packet of mush velvita type cheese sauce equals not worth the $. Go elsewhere. Sorry I wasted my $ on this","Reviewed in the United States on April 1, 2024",1.0,28,April,8,3
"This 3 pack of Kraft Mac&Cheese Deluxe was a great find at an amazing price. Locally even with coupons you cant come close to the sale price offered here at time of purchase. Boxes came in great shape, plenty of shelf life, and better still: cheap.","Reviewed in the United States on March 30, 2024",5.0,46,March,8,3
Velveeta is my favorite but these are good also,"Reviewed in the United States on March 28, 2024",4.0,9,March,8,3
This is so delicious. I want more.,"Reviewed in the United States on March 27, 2024",5.0,7,March,8,3
"Snagged a sale so I ordered this to try, it’s soooo good! We add diced ham or crumbled bacon to it for a meal.  Or rotisserie chicken 🍗 and mac…. So easy and tasty!","Reviewed in the United States on March 20, 2024",5.0,34,March,8,3
Best price was find here. Fresh and very cheesy,"Reviewed in the United States on March 19, 2024",5.0,9,March,8,3
Boxes all smashed and opened and damaged. Do not recommend,"Reviewed in the United States on March 18, 2024",1.0,10,March,8,3
"Possibly I was drunk, mac & cheese has gotten expensive. Remember like 4 years ago when they cost half this? Pretty good though as a treat for dinner.","Reviewed in the United States on March 15, 2024",5.0,28,March,8,3
"My kid who loves Mac and Cheese ate it ok, but the rest of us weren’t impressed. Won’t buy again.","Reviewed in the United States on March 10, 2024",2.0,20,March,8,3
Really good my favorite Mac and cheese.,"Reviewed in the United States on March 1, 2024",5.0,7,March,8,3
Love it,"Reviewed in the United States on February 24, 2024",5.0,2,February,8,3
"I was shocked at the small amount of macaroni in the package. I usually add my veggies to Annie’s Mac and cheese and have a nice size bowl and 4 other servings. With Kraft Mack and cheese, I tripled the amount of veggies and still didn’t have much left food. So you will not get enough to feed a family of four without other dishes. The taste is excellent. I personally would find it too strong without my added vegetables.","Reviewed in the United States on February 19, 2024",3.0,80,February,8,3
Super fast shipping,"Reviewed in the United States on February 15, 2024",5.0,3,February,8,3
More expensive in store so love getting this three pack to have on hand for three kids.,"Reviewed in the United States on February 15, 2024",5.0,17,February,8,3
Flavor is best,"Reviewed in the United States on February 8, 2024",5.0,3,February,8,3
"Been eating this since I was a kid, but as a kid it was a rare treat because the 10 for $1.00 dry mix you had to add milk and margarine to won out most nights.  I eat this and enjoy every bit.  Put leftovers in fridge and if too dry next day add some ketchup to it and it’s a great leftover.","Reviewed in the United States on February 2, 2024",5.0,63,February,8,3
"This is manufactured by Kraft, so, what do I need to say? It's the same as the Kraft I can buy in the store except it seems to be a little cheaper. Tastes good, is easy to make, and sometimes I add a microwave steam bag of vegetables to it to make it a bit healthier.","Reviewed in the United States on January 30, 2024",5.0,56,January,8,3
"This is excellent Mac & Cheese.  Just boil water, drain and mix in the readymade cheese sauce.  I love boxed Mac and Cheese, but don’t like having to add the milk, butter and powder.  Although, with the Rapid Mac Cooker, it’s fast to make.  Kraft Deluxe doesn’t do well in the Rapid Mac Cooker.  So I now boil the water on the stove.  The box says to boil the macaroni for 11 to 12 minutes.  I always taste-test pasta as it cooks.  It only takes about 8.5 to 9 minutes.  It comes out slightly al dente, but I like that way better than having the macaroni overcooked and mushy.  Of course, that’s up to each individual.  If you like the pasta a lot more tender, then I’d estimate 10 to 12 minutes.  Any way you like it, it’s excellent Mac & Cheese and very easy and fast to make.  The sauce mixes in much more easily than the powder does.  Just buy some and ENJOY!  The price is much better at the warehouse clubs.","Reviewed in the United States on January 29, 2024",5.0,174,January,8,3
Who doesn’t love mac & cheese I’ve ordered many times,"Reviewed in the United States on December 24, 2023",5.0,10,December,8,3
Love this brand always delicious with multiple meal types,"Reviewed in the United States on December 19, 2023",5.0,9,December,8,3
Like to have these for lazy days,"Reviewed in the United States on December 6, 2023",5.0,7,December,8,3
This makes it so easy to just buy this off of Amazon instead of having to run out to the store all the time. We eat this on a regular basis and for the cost it's just easier to order online.,"Reviewed in the United States on November 26, 2023",5.0,41,November,8,3
the original kraft has better flavor .this was extremely salty.,"Reviewed in the United States on November 6, 2023",2.0,10,November,8,3
Great comfort food,"Reviewed in the United States on November 5, 2023",5.0,3,November,8,3
The regular mac and cheese from Kraft isn't the same that I grew up with at all.This Deluxe version... YES. Tastes the same if not better.,"Reviewed in the United States on November 4, 2023",5.0,26,November,8,3
I always keep Kraft Deluxe Mac & Cheese on hand for when I am in the mood for comfort food or need a quick side dish. It's a reliable standby.,"Reviewed in the United States on October 9, 2023",5.0,30,October,8,3
"While texture of the noodles are better (thicker and more chewy) than the regular blue box, I could not get over the saltiness of the cheese sauce. I added a third cup of sour cream to try to tone it down, but I won't buy this again.","Reviewed in the United States on October 5, 2023",2.0,47,October,8,3
Packaging was great came a day early! Love it,"Reviewed in the United States on September 16, 2023",5.0,9,September,8,3
Like to have these boxes of mac and cheese on hand when you need a quick meal and don't have milk and butter on hand. These have the cheese packets included and you just squeeze it onto the the noodles and have a yummy meal.,"Reviewed in the United States on August 22, 2023",5.0,45,August,8,3
Good value for the money spent!,"Reviewed in the United States on August 14, 2023",5.0,6,August,8,3
i will try velveeta cheese sauce next time....,"Reviewed in the United States on August 13, 2023",1.0,8,August,8,3
My family love Mac and cheese,"Reviewed in the United States on July 30, 2023",5.0,6,July,8,3
I always buy this mac and cheese because it's good. The only thing is make sure you check the expiration date when you receive it and cook it quickly. The last few I bought gave me only 2 months to use them.,"Reviewed in the United States on July 15, 2023",4.0,42,July,8,3
I hate that I love these because they are not healthy at all therefore I make sure they are not regularly in the house.,"Reviewed in the United States on May 21, 2023",5.0,24,May,8,3
Cheesier the better,"Reviewed in the United States on May 13, 2023",5.0,3,May,8,3
comfort food,"Reviewed in the United States on April 27, 2023",5.0,2,April,8,3
This is the best box Mac & Cheese on the Market. I always top it off with some shredded cheddar cheese which gives it a killer bite.,"Reviewed in the United States on April 27, 2023",5.0,27,April,8,3
My favorite Mac and cheese. Creamy and delicious. I love this one and Velveeta shells.,"Reviewed in the United States on April 2, 2023",5.0,15,April,8,3
My family loved it but some said it had a salty flavor but I did not add salt,"Reviewed in the United States on January 12, 2023",5.0,18,January,8,3
Great packaging for the products🫶🏽 And great prices,"Reviewed in the United States on January 9, 2023",5.0,8,January,8,3
Came the way it would when bought in store,"Reviewed in the United States on December 10, 2022",5.0,9,December,8,3
I LIKE KRAFT MACARONI AND CHEESETHANK YOU,"Reviewed in the United States on November 4, 2022",5.0,7,November,8,3
The cheese mix does not taste good. I would not recommend.,"Reviewed in the United States on October 30, 2022",2.0,11,October,8,3
The Macaroni was qhat it needed to be. I was happy that there was a good expiration date!,"Reviewed in the United States on September 17, 2022",5.0,18,September,8,3
My kids love these so I buy them in multiples as I did with this order definitely cheaper here than I stores,"Reviewed in the United States on August 28, 2022",5.0,22,August,8,3
Heart warming mac and cheese its scrumptious would have you feeling fulfilled after eating,"Reviewed in the United States on August 19, 2022",5.0,14,August,8,3
This will feed 2 people max - 1 with a bit leftover if you're really hungry.,"Reviewed in the United States on August 16, 2022",5.0,16,August,8,3
The boxes remained intact.,"Reviewed in the United States on July 30, 2022",5.0,4,July,8,3
Have always bought a d never let down,"Reviewed in the United States on July 27, 2022",5.0,8,July,8,3
Keep extras in the cupboard,"Reviewed in the United States on July 23, 2022",5.0,5,July,8,3
Yummy for the tummy.,"Reviewed in the United States on July 17, 2022",5.0,4,July,8,3
"Convenient, creamy and delicious for boxed mac & cheese.","Reviewed in the United States on July 7, 2022",5.0,9,July,8,3
Was what my daughter needed for school.  Worked Good,"Reviewed in the United States on July 5, 2022",5.0,9,July,8,3
It is well worth the money. It is the original thing.,"Reviewed in the United States on June 16, 2022",5.0,11,June,8,3
Delicious product & good value,"Reviewed in the United States on May 14, 2022",5.0,5,May,8,3
Queso de polvo y no es rico,"Reviewed in the United States on December 8, 2024",1.0,7,December,9,3
You can't go wrong with Easy Mac! My boys love it!,"Reviewed in the United States on November 26, 2024",5.0,11,November,9,3
Love the fact that it cost the same for character pasta as well as the plain mac & cheese. Grandkids love these and watching paw patrol.,"Reviewed in the United States on November 14, 2024",5.0,26,November,9,3
"I bought these because of the shapes.  They are a perfect size, taste great, not mushy and quality great.  Kids loved them!","Reviewed in the United States on October 21, 2024",5.0,22,October,9,3
It taste absolutely great,"Reviewed in the United States on October 21, 2024",5.0,4,October,9,3
I really like the Kraft cups they taste just as good as regular Kraft for a good price & there a quick & easy meal for me to bring to work,"Reviewed in the United States on October 11, 2024",5.0,31,October,9,3
Very easy to cook! I bought them for my granddaughter when she comes over. They are a cute print and taste good.,"Reviewed in the United States on October 5, 2024",5.0,22,October,9,3
Kraft is the best. My Grandson loves the Sponge Bob shapes. Makes a fun meal.,"Reviewed in the United States on September 24, 2024",5.0,15,September,9,3
It's a universally acknowledged fact that the shapes just taste better that the typical macaroni shape. I'm not ashamed to say I have this on subscribe and save every two months as a small treat for myself.,"Reviewed in the United States on September 23, 2024",5.0,37,September,9,3
"I bought 3 different 4 packs of Paw patrol mac & cheese. Something is off.I don't know if they sat in the warehouse too long, or what. It smells chemical, doesn't taste like cheese. I tried 1 from each pack, will not give to my child.Thank goodness he told me they tasted funny.","Reviewed in the United States on September 13, 2024",1.0,53,September,9,3
Quick and easy,"Reviewed in the United States on September 9, 2024",5.0,3,September,9,3
I seem to make mush out of these every time I try them for my son. And I know how to cook!  Plus the amount it makes is so tiny!,"Reviewed in the United States on August 30, 2024",2.0,30,August,9,3
I got these and had left one in the microwave for awhile and it turned into a mushy paste so don't forget then in the microwave but they are pretty good I usually add some butter and a bit of milk and cheese,"Reviewed in the United States on August 25, 2024",5.0,43,August,9,3
My granddaughter absolutely loves her paw patrol lunch,"Reviewed in the United States on August 17, 2024",5.0,8,August,9,3
"Value for money, taste good, kids love it I am a return buyer","Reviewed in the United States on August 16, 2024",5.0,13,August,9,3
My kiddos love these and I love that they can make it themselves with little mess in the microwave.,"Reviewed in the United States on July 7, 2024",5.0,19,July,9,3
Easy to make and great for toddlers who are fans of Paw Patrol perfect size and great price!,"Reviewed in the United States on June 25, 2024",5.0,18,June,9,3
"Water always boils out, taste is not as good as the box","Reviewed in the United States on June 12, 2024",2.0,12,June,9,3
Great and on time,"Reviewed in the United States on June 7, 2024",5.0,4,June,9,3
I thought this was the original elbow macaroni but it’s a different shape. The microwave version turns the noodles into almost a paste. Not the right texture and the sauce is different too. :-P,"Reviewed in the United States on June 2, 2024",2.0,34,June,9,3
"Arrived fast, not expired, not damaged. What can I say other than it’s Kraft. My son loves Mac and cheese and is obsessed with paw patrol so it’s a WIN WIN for an easy quick meal.","Reviewed in the United States on May 28, 2024",5.0,36,May,9,3
Easy to prepare.  Really tasted processed.  Kraft products are usually good but these noodles and powder did not taste like food,"Reviewed in the United States on May 20, 2024",3.0,21,May,9,3
"Quick to make, very tasty","Reviewed in the United States on April 27, 2024",5.0,5,April,9,3
My slender daughter will eat these. She's very picky and I'm constantly trying to get calories into her. Pretty tasty and easy to make.,"Reviewed in the United States on April 19, 2024",5.0,24,April,9,3
Thank you,"Reviewed in the United States on April 6, 2024",5.0,2,April,9,3
Bought for my 18 yr old autistic son high functioning and he loved them as a child and still loves these now so had to buy him some lol. He ate them faster than they came in the house.,"Reviewed in the United States on April 4, 2024",5.0,39,April,9,3
my son loves these,"Reviewed in the United States on March 29, 2024",5.0,4,March,9,3
My kids loved this. Great for after school!,"Reviewed in the United States on March 27, 2024",5.0,8,March,9,3
kids love,"Reviewed in the United States on March 4, 2024",4.0,2,March,9,3
This is inedible garbage. Instead of noodles it has wheat check cereal type things. I ate one of the 4 that I purchased. I will throw the other 3 in the garbage.,"Reviewed in the United States on February 2, 2024",1.0,32,February,9,3
Food is good. the prices are a big issue!!! Check your prices at your local stores !!,"Reviewed in the United States on January 17, 2024",1.0,17,January,9,3
Great tasting. Only takes a few minutes to heat. Price was good.Will purchase again.,"Reviewed in the United States on November 12, 2023",5.0,14,November,9,3
No returns or replacements apparently.,"Reviewed in the United States on September 25, 2023",1.0,5,September,9,3
Delicious,"Reviewed in the United States on September 17, 2023",5.0,1,September,9,3
bag opened and product spilled,"Reviewed in the United States on September 13, 2023",3.0,5,September,9,3
Keep a four pack in the house. grand daughter loves it also,"Reviewed in the United States on September 9, 2023",5.0,12,September,9,3
"My grandson is a picky eater, but as soon as he saw the dogs from Paw Patrol, he was ready to eat and it was a hit !","Reviewed in the United States on August 30, 2023",5.0,28,August,9,3
Kids like it,"Reviewed in the United States on July 13, 2023",5.0,3,July,9,3
Taste good,"Reviewed in the United States on May 13, 2023",5.0,2,May,9,3
Doesn't get any easier,"Reviewed in the United States on May 12, 2023",5.0,4,May,9,3
This gets very mushy and that’s what makes it nasty as hell to eat,"Reviewed in the United States on May 10, 2023",1.0,14,May,9,3
My grands can make these when they need an alternative to the yucky stuff (and the parents approve!),"Reviewed in the United States on March 3, 2023",5.0,18,March,9,3
"My son loves Paw Patrol, so this was a fun find. I’ve noticed most of the “different” shaped pastas don’t hold up as well when you stir the cheese packet in. There’s lots of holes and thin areas, so they tend to break up and look mashed.Tip: Use a spoon, not a fork, to stir. They’ll hold their shape better! Also, try adding a little pat of butter to get rid of the “fake cheesy chemical” taste. I find it tastes more like boxed Mac & cheese that way. Yum! 😋","Reviewed in the United States on January 21, 2023",4.0,91,January,9,3
Easy to make. Kids love them,"Reviewed in the United States on January 17, 2023",5.0,6,January,9,3
