Text,Location/Date,Stars,Word Count,Month,Product,Brand
My little one loved it. Good size and quality is good. Kids friendly. Fit in budget. Highly recommend it.,"Reviewed in the United States on August 9, 2024",5.0,19,August,3,1
great product from amazon,"Reviewed in the United States on August 5, 2024",5.0,4,August,3,1
Highly recommend this toothpaste for kids. Good on  their  teeth. And definitely cannot beat the price for three.,"Reviewed in the United States on July 31, 2024",5.0,18,July,3,1
Very nice toothpaste for kids. Nice packaging. Cleans teeth nicely!!,"Reviewed in the United States on July 29, 2024",5.0,10,July,3,1
Nothing special,"Reviewed in the United States on July 27, 2024",3.0,2,July,3,1
A mi hija le gusta,"Reviewed in the United States on July 24, 2024",5.0,5,July,3,1
Our 3 year old love the taste of this toothpaste!,"Reviewed in the United States on July 24, 2024",5.0,10,July,3,1
My kids love this flavor- great deal.,"Reviewed in the United States on July 10, 2024",4.0,7,July,3,1
"We are very satisfied with the product. However, we later found that the price was not competitive as compared other retailers. I would cross check the prices next time I purchase items.","Reviewed in the United States on June 30, 2024",5.0,32,June,3,1
Duradera,"Reviewed in the United States on June 25, 2024",5.0,1,June,3,1
"My kids' favorite toothpaste. They love the taste, I love the price. Doctor approved.","Reviewed in the United States on June 15, 2024",5.0,14,June,3,1
Sure the Crest Toothpaste matches the expectation for all the kids that’s the reason its their favorite,"Reviewed in the United States on June 15, 2024",4.0,17,June,3,1
My favorite tooth paste to use for my daughter.. it cleans her teeth so well!,"Reviewed in the United States on June 10, 2024",5.0,15,June,3,1
"My 11 year old son is picky when it comes to toothpaste. He enjoys this product's flavor and freshness. It comes in the perfect size for everyday or travel. His teeth appear whiter and clean. Overall, great performance for a non-sensitive kids' toothpaste.","Reviewed in the United States on June 9, 2024",5.0,43,June,3,1
My son loved this flavor. I'll definitely be repurchasing in the future. Big tube's as well.,"Reviewed in the United States on June 5, 2024",5.0,16,June,3,1
Always buy for my 5 year old son. Worth money for the pack. Quality great. Texture is good. Size is big and worth money. Easy to use,"Reviewed in the United States on June 2, 2024",5.0,27,June,3,1
"My kids like it’s flavor, kind of bubble gum and fresh.","Reviewed in the United States on May 30, 2024",5.0,11,May,3,1
"My son is almost 5 years old and he likes the toothpaste. He likes the taste and color!I have been using another big brand for the last couple of years( that his dentist reccommend) but his front two upper teeth were so dark… so I decided to switch to crest!  My son has been using it for less that a week and I see amazing result! The darkness/ coloring is gone! Teeth look clean, white, smells great! definately reccommend!","Reviewed in the United States on May 29, 2024",5.0,79,May,3,1
Hate the flavor but my kids like it,"Reviewed in the United States on May 28, 2024",1.0,8,May,3,1
"Bought on sale, cheaper than Walmart! My kids love it!","Reviewed in the United States on May 28, 2024",5.0,10,May,3,1
"My children adore anything that sparkles, and that includes this toothpaste. We’re big fans of the value pack.","Reviewed in the United States on May 26, 2024",5.0,18,May,3,1
Great value & product.,"Reviewed in the United States on May 26, 2024",5.0,4,May,3,1
Usually buy this,"Reviewed in the United States on May 25, 2024",5.0,3,May,3,1
using this brand for years,"Reviewed in the United States on May 19, 2024",5.0,5,May,3,1
My family loves this,"Reviewed in the United States on May 16, 2024",5.0,4,May,3,1
"We've been using this toothpaste brand for several years now, and it's the only one my picky children actually like! The flavor is great, which makes it easier to encourage them to brush their teeth regularly. Its cleaning power is impressive, and it effectively helps prevent cavities, making it a reliable choice for our family.  We've tried several brands over the years, but we always come back to this one. Highly recommended for families with kids!","Reviewed in the United States on May 16, 2024",5.0,76,May,3,1
"The mint flavor is too stimulating for children aged 3-4 years old and is not suitable for children😅😅😅 The blue paste is very popular with children, but the taste is too pungent. The children said it is ""spicy"".","Reviewed in the United States on May 14, 2024",3.0,38,May,3,1
"We have tried a few different flavors, but my kids just like this one before it has no mint - mint to kids is too strong smelling and feeling.","Reviewed in the United States on May 13, 2024",5.0,29,May,3,1
I buy this toothpaste for my son because he likes it. 3 for $4 is unbeatable!,"Reviewed in the United States on May 12, 2024",5.0,16,May,3,1
Excélente para los nińos,"Reviewed in the United States on May 12, 2024",5.0,4,May,3,1
"Great toothpaste.  Not harsh on the gums, and does not burn.","Reviewed in the United States on May 8, 2024",5.0,11,May,3,1
Great toothpaste!,"Reviewed in the United States on May 7, 2024",5.0,2,May,3,1
The only brand I've been using for my toddler.,"Reviewed in the United States on May 7, 2024",5.0,9,May,3,1
My son loves this toothpaste. Some toothpastes he complains that it’s too “spicy” but he does great with this kind and keeps his teeth looking great!,"Reviewed in the United States on May 6, 2024",5.0,26,May,3,1
"My younger brothers and sisters LOVE this! As it has that strawberry taste and color, a little sweet, shines your teeth really good! Easy to use for kids! Easy to open and squeeze !!🔥","Reviewed in the United States on April 29, 2024",5.0,34,April,3,1
"Only toothpaste my kids will use. They love the smell, the color and the taste. It makes their teeth feel and look clean. I have to help them with the lid and dispensing the gel but other than that they like it.","Reviewed in the United States on April 28, 2024",5.0,42,April,3,1
This is the one toothpaste my daughter will use. She loves the taste!,"Reviewed in the United States on April 24, 2024",5.0,13,April,3,1
my kiddo doesnt like minty toothpaste and this is perfect for him.,"Reviewed in the United States on April 19, 2024",5.0,12,April,3,1
"The media could not be loaded.I purchased the Crest Kid's Cavity Protection Toothpaste in Sparkle Fun for my toddler. The size is perfect for little hands, and the toothpaste is easy to use. It has a pleasant smell and taste that my child enjoys. The toothpaste leaves his teeth feeling clean without any issues of dryness or sensitivity. The fun color adds to the appeal for kids. Overall, it's a great toothpaste option for children, combining fun and effective cavity protection.","Reviewed in the United States on April 19, 2024",5.0,81,April,3,1
Ease of use and the size perfect,"Reviewed in the United States on April 17, 2024",3.0,7,April,3,1
"My kids love the flavor , its good quality from a trusted brand ,","Reviewed in the United States on April 12, 2024",5.0,14,April,3,1
My kids like the taste of this toothpaste,"Reviewed in the United States on April 10, 2024",5.0,8,April,3,1
"I purchased some other toothpastes and my lids didn’t liked the flavors, but these ones are great. I highly recommend it.","Reviewed in the United States on April 9, 2024",5.0,21,April,3,1
Cleaning my teeth.,"Reviewed in the United States on April 7, 2024",5.0,3,April,3,1
"Both my kids are finally at the age to brush their teeth, so I wanted a value pack so I never run out! This toothpaste is great! I always love anything crest, and my kids will even say mmm when they go to brush their teeth. This makes toddlers brushing their teeth so much easier, since they enjoy the taste!","Reviewed in the United States on April 3, 2024",5.0,60,April,3,1
"Always loved this magical sparkle toothpaste. Loved getting to use this stuff at a friends house growing up. THEN my kids got a tiny tube of it from the dentist. So, I treated them to it because how cool that TOOTHPASTE is a prize?!?! Good value, too. Win, win, win. -mother of 5 honest late night reviewer on husband’s account, at your service.","Reviewed in the United States on April 2, 2024",5.0,63,April,3,1
Muy bueno para la muchacha,"Reviewed in the United States on December 19, 2024",5.0,5,December,4,2
"The speaker sounds a bit better than the past generation, and the sounds are noticeably clearer (or less muddy). Although I like both the old and new designs, I personally like this a bit more. It feels surprisingly high quality in the hand and is the obviously better deal when compared with a HomePod mini's price-to-performance ratio. I am a big fan of this Echo Dot generation's aesthetics. To me, it looks and feels premium--like a tech product I would leave purposely visible as part of my area, opposed to one I would manage hidden under my desk, behind a lamp, etc. My favorite new feature is the inclusion of a tap-to-play/pause function, and my biggest complaint is the lack of further music/media integration on the Alexa mobile app (as trying to play or queue up specific songs/playlists from Apple Music can be frustrating).Overall, you can't go wrong with this speaker for the price (and functionality it offers), especially when pairing two for a stereo pair.","Reviewed in the United States on December 19, 2024",5.0,166,December,4,2
Love this thing next to my bed. I can ask almost anything.,"Reviewed in the United States on December 19, 2024",4.0,12,December,4,2
"El Echo Dot es un dispositivo muy versátil. Crea rutinas con la app de Alexa, cómo encender las luces  y reproducir música al despertar. Puede cambiar su nombre de activación . Cada cual puede personalizar su experiencia vinculado con cuentas.Comecta dispositivos inteligentes como luces, termostatos, o cámaras compatibles con Alexa. Usa llamadas y envía mensajes","Reviewed in the United States on December 18, 2024",5.0,55,December,4,2
Great product,"Reviewed in the United States on December 18, 2024",5.0,2,December,4,2
Works well good sound best alexa so far... now if she would just give me correct answers,"Reviewed in the United States on December 18, 2024",5.0,17,December,4,2
I am having difficulty getting the bluetooth to connect. I wanted to listen to my You tube connecting with the bluetooth. I haven't give up yet but so far not working as I had expected. If you use other music apps listed I think you will be happy with the speaker.,"Reviewed in the United States on December 18, 2024",3.0,51,December,4,2
So this black device came with a white cord. Was not expecting that at all. All my previous Echo devices came with a black cord. Seems like not the end of the world. I have a tower power strip that is pretty full. Sits on floor. The other black cords in there don't really show. Kind of blend in with the shadows near the floor. This one looks terrible and the white sticks out like a sore thumb and a beacon in the night. Looks really messy and tacky. I honestly would not have purchased this device if I had known it had a black cord. Never seen a white cord from Amazon. I should have looked at the pics more thoroughly perhaps. Given my past experience it never crossed my mind. Sorry I bought it and not going to use it. How does it work? I don't know. Not using it and leaving my old Echo thing there.,"Reviewed in the United States on December 18, 2024",1.0,159,December,4,2
I  absolutely love it . Perfect volume and easy set up,"Reviewed in the United States on December 18, 2024",5.0,11,December,4,2
"Alexa is literally so unhelpful and incompetent. She can do like 2 things max. It's sad, pitiful, and a disgrace to the technological community. SHAME ON YOU BEZOS: your lies are empty promises. I'd have better luck asking my dishwasher to do anything.","Reviewed in the United States on December 18, 2024",1.0,43,December,4,2
Far outshadows earlier units. I now have 3 of these for different areas in the home.,"Reviewed in the United States on December 18, 2024",5.0,16,December,4,2
Best ever,"Reviewed in the United States on December 18, 2024",5.0,2,December,4,2
"For the price, the sound quality is impressive.  It's ability to hear you and respond while playing music is much better than previous versions.","Reviewed in the United States on December 18, 2024",5.0,24,December,4,2
"Amazon keeps taking away the things you use most and now want you to get a subscription. I pay for prime and still they want more. I don’t want to pay for Amazon music just to hear brown noise at night. Last night  They took the “skill” away. Why can’t I buy just that one thing like they can on iTunes? Even if they let me use it again someday, it’s not worth the commercial asking  for more money (I don’t have) every time I want to use it.","Reviewed in the United States on December 18, 2024",1.0,89,December,4,2
Love it! For the price we are practically stealing it.Reminds me to take out trash every week it's great,"Reviewed in the United States on December 18, 2024",5.0,19,December,4,2
"One of the most genuine pieces of garbage I’ve ever bought ; the probelm with the Amazon echo is the constant push advertisement. Do you wanna actually use the machine you spent your hard worked money on? Too bad cause there’s around 50 paywalls for literally everything; I do the most basic mechanics “Alexa turn on the light” after 2 months it stopped working and now when I turn on the light Jeffery Bozo shoves the fact I can have some celebrity from the 90’s who needs another paycheck ; say In their funny little voice how great it is I’m turning on my lights for 5 dollars a month! WOW !! And that’s not all, if I wanna rest my eyes after a long day and I ask Alexa to play some white noise ; 7/10 times she’s gonna be advertising “better white noise” and the advertisement is going to last 3 minutes each time unless you scream at the robot to stop , and play your white noise, and once a month it just straight up “can’t access it” . If you want an Alexa for 20 dollars, make sure you have an extra 200 for the 2 years this thing will work.","Reviewed in the United States on December 18, 2024",1.0,205,December,4,2
"Excelente, recomendado","Reviewed in the United States on December 18, 2024",5.0,2,December,4,2
"Great product to play music, hear Amazon notification, and ask general questions.","Reviewed in the United States on December 18, 2024",4.0,12,December,4,2
Products exactly as advertised would purchase from seller(s) again in the future.,"Reviewed in the United States on December 18, 2024",5.0,12,December,4,2
Love it!!!,"Reviewed in the United States on December 18, 2024",5.0,2,December,4,2
"I have 2 other echo dots, the older ones, which work GREAT.  This one, I have to actually repeat EVERY command, every time. When it is playing, it sounds great.  This machine has to be restarted at least once a week to work.  It is close to WIFI, so it should work fine.  Very disappointed in this Echo Dot.  Maybe I received a defective machine?  Or maybe the older ones are better.","Reviewed in the United States on December 18, 2024",2.0,72,December,4,2
The sound quality is excellent and set up was very easy. Appreciate being able to give command and get the response right away.,"Reviewed in the United States on December 17, 2024",5.0,23,December,4,2
Small but loud. I really wish they left the clock feature I would really have liked that model. But this works great mainly for it because I need a secondary temperature sensor for my Amazon thermostat. Well made feels durable. And speaker sounds good if it had the clock I would give it 5 stars especially on sale.,"Reviewed in the United States on December 17, 2024",4.0,58,December,4,2
I bought this for my best friend. She is truly in love with it and now we can communicate through alexa anytime we want to speak to each other.,"Reviewed in the United States on December 17, 2024",5.0,29,December,4,2
"Love this Echo.  Had an earlier one, and just couldn't get along with it.  The sound is very clear and understandable, and it immediately hooked up with my modem.  Like the round shape, and think that has a lot to do with the clearness of the product.  So easy to go through a lot of the features.  Took but a minute to get news, weather, music and set alarm.  Would heartily recommend this.","Reviewed in the United States on December 17, 2024",5.0,73,December,4,2
This was delivered over night and was super simple to install.,"Reviewed in the United States on December 17, 2024",5.0,11,December,4,2
MI HIJA PEQUEÑA ESTA FASCINADA,"Reviewed in the United States on December 17, 2024",5.0,5,December,4,2
"Well made, functions as expected, good quality.","Reviewed in the United States on December 17, 2024",5.0,7,December,4,2
"It seems like a good item, but even though there is a “switch” for turning off its “listening” capabilities, if a device can be hacked, and this one can be hacked, the switch is not fool-proof.  And because we bought it with Amazon courtesy credits due to a series of botched deliveries, we can’t get the purchase value refunded.  We never even opened the box. Got it for a senior who is uncomfortable with eavesdropping. I’m sure it is a good item for people who are not concerned about that though.","Reviewed in the United States on December 17, 2024",1.0,91,December,4,2
Me encanta. Llegó en buen estado y es buen material. Yo compré dos y amo los resultados,"Reviewed in the United States on December 17, 2024",5.0,17,December,4,2
"Alexa has made life a little easier to manage our home and fun for the kids to enjoy. You have the ability to create routines for household. Made waking up my children easier. Sound quality is greats and kids love it. Great values, easy to install.","Reviewed in the United States on December 17, 2024",5.0,46,December,4,2
"i’ve been trying to change the music settings to disable Amazon music so that it won’t play Amazon music anymore. It will only play my Spotify, but apparently Amazon does not let you change the settings around. If you research it it will tell you you can that Amazon has changed the settings to the point where you have to leave Amazon music on your echo dot there’s nothing you can do about it and even if you change your music preferences to Spotify, it still will use Amazon music which makes absolutely no damn sense. up until now I actually liked it, but they say you can ask the Alexa to do things in the settings and apparently you can’t do any of that because if you ask Alexa to do anything in the settings, she just opened settings for you and doesn’t explain or take you to any of the stuff you’re asking her to. maybe if they make it so you can take the Amazon music off the echo dot a easier, ill like it more but its slowly starting to aggravate me like there terrible basic light bulbs……","Reviewed in the United States on December 17, 2024",2.0,192,December,4,2
Not good looked like it was returned and re sent to new customer.  Have have two at home never had a problem. Wanted new on for living room. Before Christmas,"Reviewed in the United States on December 17, 2024",1.0,30,December,4,2
"The Amazon Echo Dot is the perfect addition to any home, combining a compact design with impressive sound quality and Alexa’s endless capabilities. Whether it’s for music, smart home control, or quick voice commands, this little speaker delivers big results.The sound is surprisingly vibrant and clear for such a small speaker. The bass is punchy, vocals are crisp, and it easily fills a bedroom, dining room, or small living space. It’s perfect for streaming playlists, podcasts, or even ambient sounds for relaxation.Alexa works flawlessly with this device. From controlling my smart lights and thermostat to setting timers, alarms, and reminders, the Echo Dot has quickly become part of my daily routine. It’s also great for quick weather updates, news, and fun trivia with Alexa’s skills.The sleek, modern design fits beautifully in any room. It’s compact enough to sit on a nightstand, kitchen counter, or shelf without taking up much space. The built-in LED display on some models is a bonus for showing the time or alarms.It seamlessly connects to other smart home devices, making it a hub for my smart lights, plugs, and speakers. Multi-room audio is a game-changer when paired with other Echo devices – I can play music throughout the house with a simple voice command.","Reviewed in the United States on December 17, 2024",5.0,208,December,4,2
We love it. We have it in our kitchen. I have the echo 5 in our living room.,"Reviewed in the United States on December 17, 2024",5.0,18,December,4,2
I like it i hope help me so much,"Reviewed in the United States on December 17, 2024",5.0,9,December,4,2
Touch screen,"Reviewed in the United States on December 17, 2024",4.0,2,December,4,2
One of my main reasons for buying echo devices was to stream radio stations I couldn’t get over the air. It worked great for months until recently when suddenly the stations cut in and out repeatedly. All radio stations. Unusable. Very frustrating with no fix in sight from the tech gurus from Amazon. Would not buy again unless problem is fixed!,"Reviewed in the United States on December 17, 2024",2.0,61,December,4,2
I bought a Marshall Emberton II Bluetooth Speaker but unfortunately this echo dot can’t find the device and won’t connect.,"Reviewed in the United States on December 17, 2024",1.0,20,December,4,2
"For the price, the new Echo Dot is unbeatable. It’s small, powerful, and seamlessly integrates into my smart home setup. Whether you’re upgrading an older model or buying your first smart speaker, I highly recommend it!","Reviewed in the United States on December 17, 2024",5.0,36,December,4,2
I wonder how I got through my life before getting the echo dot and Alexa! It was so easy to set up before I even got it it was ready to just plug and play right out of the box. Alexa doesn’t do what I always ask/tehh her to do but most of the time she responds quickly and clearly,"Reviewed in the United States on December 17, 2024",5.0,60,December,4,2
,"Reviewed in the United States on December 17, 2024",5.0,0,December,4,2
I love that I can have my favorite music anytime. Still learning so not sure how far Alexa and I will go.,"Reviewed in the United States on December 17, 2024",4.0,22,December,4,2
Tal y como se ve perfecto muy bonito y efectivo,"Reviewed in the United States on December 17, 2024",5.0,10,December,4,2
Set it on a small table in the dining area mainly for music; works great,"Reviewed in the United States on December 16, 2024",5.0,15,December,4,2
Love it,"Reviewed in the United States on December 16, 2024",5.0,2,December,4,2
Product came as should with no damage to box. Works as should.,"Reviewed in the United States on December 16, 2024",4.0,12,December,4,2
MARAVILLOSA PONGO TODAS MIS MUSICAS,"Reviewed in the United States on December 16, 2024",5.0,5,December,4,2
"I gave 4 stars only because it doesn't display the time like the generation 4 does that is disappointing, it's suppose to be a better sound quality but I don't know because I didn't buy it to listen to music. It was on black Friday special so was less money still would have been nice to look at time and see it also it was bought for a guest room. Still it works well when you speak to it.","Reviewed in the United States on December 16, 2024",4.0,79,December,4,2
"I don't get what all the hype is for this thing.  My 10 yo bought the Echo with his own money and it's a pile of junk.  We can only get Pandora to work.  Every account I link goes to the ""Family"" profile so I can't even get the skill to work for myself let alone a childs profile.  I suspect if I paid the annual subscription for Amazon Kids+ it would work seamlessly.  I just refuse to subscribe when there is tons of free content...alexa just doesnt work with other streaming services like it claims.I am probably going to have to create my 10yo his OWN amazon account so that I can setup the Alexa app for his account rather than trying to give him skills as a child profile on my account.  This completely defeats the purpose of child profiles.  Do your research: look at the ratings on the amazon skills.  Most of them are 2 stars.","Reviewed in the United States on December 16, 2024",1.0,159,December,4,2
I got a Echo dot as a gift from a company. It does not connect to internet. I tried to connect to Amazon help team. They could not solve the problem. The answer from them is just to trash it as it is not bought from amazon website. How can Amazon manufacture and say they will only support if it is bought from amazon.com. It was crazy experience and definitely not expected at all from Amazon. I had to give 1 rating if there was a chance i would have given less than that for product not working and service not helping,"Reviewed in the United States on December 16, 2024",1.0,102,December,4,2
Excelente producto,"Reviewed in the United States on December 16, 2024",5.0,2,December,4,2
No funciona no reproduce musica en realidad me párese que es tirar el dinero,"Reviewed in the United States on December 16, 2024",1.0,14,December,4,2
"Kind of a useless toy for nerds.  I used it for a week or so, but could never see how it would help my day.  It's nice tech - but you're exposed to listening/hacks by these companies.  I could accomplish the same thing by typing (privately) on phone rather than saying it out loud ...  So junk after a month ....","Reviewed in the United States on December 16, 2024",2.0,61,December,4,2
"Excelente, todo mundo debe tener una en cada","Reviewed in the United States on December 16, 2024",5.0,8,December,4,2
